{
  "$schema": "../../schemas/evidence.schema.json",
  "schema_version": "1.1.0",
  "id": "EVD-VA-TANGENT-FRAME-001",
  "experiment_id": "EXP-VA-TANGENT-FRAME-001",
  "artifact_type": "measurement",
  "repository_path": "lab/evidence/runs/EXP-VA-TANGENT-FRAME-001/tangent_frame.json",
  "external_reference": null,
  "sha256": "4b36b74c19c56d7946b34410ca0cbf4af9a33d9f8fb1fed0521833c991d20aec",
  "byte_size": 1629,
  "provenance": "Generated by test_tangent_frame.py inside Blender 5.0.1 a3db93c5b259.",
  "recorded_at": "2026-07-20T13:23:39.122983+00:00",
  "blender_version": "5.0.1 a3db93c5b259",
  "render_engine": null,
  "scene_revision": null,
  "observation_ids": [
    "OBS-VA-TANGENT-FRAME-001"
  ],
  "rights_status": "original",
  "retention_note": "Mathematical invariant only; no shader-appearance claim."
}
