{
  "$schema": "../../schemas/evidence.schema.json",
  "schema_version": "1.1.0",
  "id": "EVD-VA-BLENDER-INVENTORY-001",
  "experiment_id": "EXP-VA-BLENDER-SMOKE-001",
  "artifact_type": "mesh-report",
  "repository_path": "evidence/runs/EXP-VA-BLENDER-SMOKE-001/inventory.json",
  "external_reference": null,
  "sha256": "edafed99103c16c2bccb40f99bc381e00144533a436c1f1c560ca035a83dae06",
  "byte_size": 2553,
  "provenance": "Captured non-destructively by asset_inventory.py from the synthetic smoke scene.",
  "recorded_at": "2026-07-20T01:17:09.361474+00:00",
  "blender_version": "5.0.1 a3db93c5b259",
  "render_engine": "EEVEE",
  "scene_revision": "synthetic-structural-smoke-v1",
  "observation_ids": ["OBS-VA-BLENDER-SMOKE-001"],
  "rights_status": "original",
  "retention_note": "Structural inventory only; no geometry-quality or shading claim."
}
